{
  "evidence_id": "EVID-AR-Senate-2025-11-25-RHTP-RISEAR-Approx161M",
  "section": "MF-AR-RHTP-RISEAR-2026",
  "claim_summary": "An Arkansas Senate post (Nov 25, 2025) describes the RISE AR initiative in Arkansas' RHT proposal as costing approximately $161 million.",
  "evidence_type": "grant",
  "source": {
    "title": "Rural Health Transformation (RHT) Program",
    "issuing_body": "Arkansas Senate",
    "url": "https://senate.arkansas.gov/senate-news/posts/2025/november/rural-health-transformation-rht-program/"
  },
  "confidence_level": "high",
  "editor_status": "accepted"
}
