{"evidence_id":"EVID-AR-ACT890-2025-DHS-DAABHS-CRISIS-SERVICES","section":"Act 890 of 2025 â€” DHS DAABHS appropriation items incl. crisis services and related line-items","claim_summary":"Arkansas Act 890 of 2025 contains FY2026 DHS Division of Aging, Adult, and Behavioral Health Services (DAABHS) appropriations, including items referenced in-thread such as Substance Abuse Prevention and Alcohol and Drug Abuse Coordinating Council state funds line-items.\n","evidence_type":"budget","source":{"title":"Arkansas Act 890 of 2025 (DHS DAABHS Appropriations)","issuing_body":"Arkansas General Assembly","url":"https://arkleg.state.ar.us/Acts/FTPDocument?path=%2FACTS%2F2025R%2FPublic%2F&file=890.pdf&ddBienniumSession=2025%2F2025R"},"confidence_level":"high","editor_status":"pending"}