{
  "evidence_id": "EVID-AR-LegAudit-2025-BudgetHearings-AOC-FY2022-Finding-AppropriationMisuse",
  "section": "AR_FY2026_AOC_SPECIALTY_COURTS_STATE_CENTRAL_SERVICES_ACT776_SEC31 (Audit finding re: appropriations use; not specialty-court specific)",
  "claim_summary": "Arkansas Legislative Audit summarized a finding (AOC, year ended June 30, 2022) stating that AOC used appropriations for one purpose for another purpose (reimbursements vs dependency-neglect professional fees), and referenced a statutory transfer cap of not more than $4 million in Ark. Code Ann. § 16-10-310(d)(1) as a potential solution.",
  "evidence_type": "field_validation",
  "source": {
    "title": "Audit Findings for Budget Hearings — 2025 Regular Session",
    "issuing_body": "Arkansas Legislative Audit / Arkansas General Assembly (budget manuals)",
    "url": "https://www.arkleg.state.ar.us/Home/FTPDocument?path=%2FAssembly%2F2025%2FSummary+Budget+Manuals%2FAudit+Findings+for+Budget+Hearings+-+2025+Regular+Session.pdf"
  },
  "confidence_level": "high",
  "editor_status": "accepted"
}
