{"evidence_id":"EVID-AR-ACT1004-2025-S8-DHS-Secretary-PurchaseOfServices-129084-FY2026","section":"AR_FY2026_DHS_SECRETARY_OFFICE_GRANTS_PAYING_PURCHASE_OF_SERVICES_ACT1004_SEC8","claim_summary":"Act 1004 of 2025 appropriates $129,084 to the Department of Human Services - Secretary's Office for grants and paying account purchase of services for FY2026.","evidence_type":"budget","source":{"title":"Act 1004 of 2025 â€” DHS Secretary's Office Appropriation","issuing_body":"Arkansas General Assembly","url":"https://arkleg.state.ar.us/Home/FTPDocument?path=%2FAssembly%2FMeeting+Attachments%2F083%2F27496%2FExhibit+B2-+Act+1004+of+2025.pdf"},"confidence_level":"high","editor_status":"accepted"}