{"evidence_id":"EVID-AR-ACT776-2025-S34-ByrneJAG-150000-FY2026","section":"AR_FY2026_AOC_BYRNE_JAG_BEHAVIORAL_HEALTH_COLLAB_FEDERAL_FUNDS_ACT776_SEC34","claim_summary":"Act 776 of 2025 appropriates $150,000 in federal funds to the Administrative Office of the Courts for grants and aid to improve collaborative efforts with behavioral health and criminal justice stakeholders for the fiscal year ending June 30, 2026.","evidence_type":"budget","source":{"title":"Act 776 of 2025 (SB72) â€” AOC Appropriation","issuing_body":"Arkansas General Assembly","url":"https://arkleg.state.ar.us/Acts/FTPDocument?ddBienniumSession=2025%2F2025R&file=776.pdf&path=%2FACTS%2F2025R%2FPublic%2F"},"confidence_level":"high","editor_status":"accepted"}